ID_PRODUCTO,Comentario
42737,Producto de calidad excepcional, ideal para trabajos de impresión de alta resolución.
42754,Excelente placa base, fácil instalación y rendimiento estable para tareas de oficina y multimedia.
42755,Una opción económica y fiable para sistemas de gama baja, ideal para tareas básicas.
42756,Perfecta para usuarios que necesitan un rendimiento decente a un precio asequible.
42757,Una placa base robusta para usuarios que necesitan una opción de gama media.
42758,Buen rendimiento y calidad para usuarios que buscan algo accesible y funcional.
42759,Recomendado para quienes buscan un sistema fiable con soporte para múltiples dispositivos.
42760,Ideal para equipos de oficina o pequeñas empresas con necesidades de bajo consumo energético.
42761,Una excelente opción para usuarios que necesitan un buen equilibrio entre precio y rendimiento.
42762,Perfecta para jugadores y usuarios que buscan alto rendimiento en tareas multitarea.
42763,Placa base para aquellos que buscan eficiencia y rendimiento a buen precio.
42764,Una opción accesible para aquellos que buscan un sistema fiable para tareas cotidianas.
42765,Recomendado para quienes requieren una solución versátil para sus configuraciones de PC.
42766,Ideal para usuarios avanzados que buscan una placa base de alto rendimiento.
42767,Placa base robusta y confiable, ideal para configuraciones profesionales.
42768,Ideal para usuarios que buscan una placa base económica y de fácil instalación.
42769,Una excelente opción para quienes buscan un sistema con soporte de alto rendimiento.
42770,Recomendado para quienes necesitan un disco duro de alta capacidad y durabilidad.
42771,Perfecto para quienes necesitan una solución de almacenamiento en un dispositivo portátil.
42772,Un disco duro de alta capacidad para quienes requieren un almacenamiento masivo.
42773,Disco duro de alto rendimiento, ideal para usuarios que trabajan con grandes volúmenes de datos.
42774,Una excelente opción de almacenamiento SSD para mejorar el rendimiento de tu equipo.
42775,Recomendado para quienes buscan una solución SSD asequible pero confiable.
42776,Un disco duro compacto con gran capacidad para mejorar la velocidad de trabajo.
42777,Disco duro de alto rendimiento y capacidad ideal para portátiles.
42778,Una opción económica para quienes necesitan un disco duro con un buen rendimiento.
42779,Excelente elección para quienes buscan almacenamiento en red, ideal para pequeños servidores.
42780,Perfecto para usuarios que necesitan almacenamiento externo de gran capacidad.
42781,Recomendado para quienes buscan un disco duro externo portátil y fiable.
42782,Ideal para quienes requieren almacenamiento externo de alta capacidad.
42783,Disco duro externo fiable y duradero, ideal para backups regulares.
42784,Una opción robusta y económica para quienes necesitan almacenamiento en dispositivos portátiles.
42785,Recomendado para quienes necesitan un disco duro USB 3.0 fiable y accesible.
42786,Una buena opción de memoria USB para quienes buscan alta velocidad de transferencia.
42787,Excelente opción de memoria RAM para aquellos que buscan mejorar el rendimiento de su sistema.
42788,Una memoria USB rápida y fiable para quienes necesitan almacenamiento portable.
42789,Recomendado para aquellos que buscan una solución de almacenamiento fiable y accesible.
42790,Memoria USB de alta capacidad, ideal para almacenar y transferir grandes archivos.
42791,Perfecto para quienes buscan una memoria SD confiable para cámaras y otros dispositivos.
42792,Una opción económica de memoria microSD para quienes necesitan un rendimiento constante.
42793,Ideal para quienes requieren almacenamiento de alta capacidad en un dispositivo móvil.
42794,Una buena opción de memoria SD para cámaras y otros dispositivos multimedia.
42795,Recomendado para quienes buscan una memoria microSD con gran capacidad y rendimiento.
42796,Memoria microSD fiable para quienes necesitan un rendimiento constante.
42797,Una opción de memoria RAM de alto rendimiento para usuarios avanzados.
42798,Memoria DDR3 asequible y fiable para tareas básicas en PC de oficina.
42799,Excelente opción de memoria RAM para quienes buscan mejorar el rendimiento de su laptop.
42800,Producto económico y funcional para tareas básicas.
42801,Memoria DDR4 ideal para quienes buscan un buen rendimiento a un precio razonable.
42737,"Producto de gran calidad, ideal para trabajos de oficina y multimedia."
42754,"Muy buena placa base, fácil instalación y perfecto rendimiento en tareas diarias."
42737,"Una excelente opción para quienes buscan fiabilidad y bajo costo."
42755,"Opción económica y funcional para equipos de bajo rendimiento."
42756,"Rendimiento decente para tareas básicas, ideal para quienes no buscan algo de alto rendimiento."
42757,"Ideal para usuarios intermedios que requieren algo de gama media."
42758,"Excelente opción para quienes necesitan una solución fiable y accesible."
42759,"Recomendado para quienes necesitan algo con buen soporte para múltiples dispositivos."
42754,"Buena opción para quienes buscan una configuración rápida y económica para oficina."
42760,"Perfecto para aquellos que necesitan una solución de bajo consumo energético."
42761,"Ideal para usuarios que buscan algo versátil y de buen rendimiento."
42762,"Recomendado para quienes buscan un producto con alto rendimiento para gaming y multitarea."
42763,"Una opción sólida para quienes buscan eficiencia y buen precio."
42764,"Excelente para quienes necesitan algo accesible pero confiable."
42765,"Placa base versátil que sirve para configuraciones personalizadas y de rendimiento medio."
42766,"Ideal para quienes buscan placas base de alto rendimiento para tareas pesadas."
42767,"Placa base resistente y confiable, perfecta para profesionales."
42768,"Una opción económica y fácil de instalar, perfecta para usuarios que inician en el mundo del PC."
42769,"Ideal para quienes necesitan un buen rendimiento para sistemas de oficina."
42770,"Recomendado para quienes necesitan un almacenamiento rápido y confiable."
42771,"Excelente opción de disco duro externo para portátiles, compacta y fiable."
42772,"Disco duro grande, ideal para almacenar grandes volúmenes de datos de forma segura."
42773,"Alta velocidad y rendimiento, perfecto para usuarios que manejan grandes archivos."
42774,"Una opción SSD excelente para mejorar el rendimiento del equipo y trabajar de manera más rápida."
42775,"Recomendado para quienes buscan una opción SSD económica pero confiable."
42776,"Excelente disco duro con gran capacidad para almacenar información crítica."
42777,"Disco duro de alto rendimiento, ideal para portátiles con almacenamiento masivo."
42778,"Una opción económica para quienes necesitan algo funcional con buen rendimiento."
42779,"Perfecto para quienes buscan almacenamiento en red confiable para servidores pequeños."
42780,"Excelente para quienes necesitan almacenamiento externo para copias de seguridad."
42781,"Una opción fiable de disco duro USB 3.0, ideal para aquellos que buscan alta velocidad de transferencia."
42782,"Ideal para quienes requieren almacenamiento externo de gran capacidad."
42783,"Disco duro externo ideal para quienes buscan seguridad y durabilidad en sus backups."
42784,"Excelente opción económica para quienes necesitan almacenamiento portátil fiable."
42785,"Recomendado para quienes buscan un dispositivo USB 3.0 rápido y accesible."
42786,"Una excelente opción de memoria USB para quienes necesitan velocidad en sus transferencias."
42787,"Perfecto para quienes buscan mejorar el rendimiento de su sistema con memoria RAM de alta calidad."
42788,"Ideal para quienes buscan una memoria USB rápida y confiable para sus datos."
42789,"Recomendado para quienes buscan una opción de memoria USB accesible y fiable."
42790,"Memoria USB con gran capacidad, ideal para almacenar archivos pesados."
42791,"Excelente opción para quienes buscan memoria SD confiable para cámaras y dispositivos multimedia."
42792,"Opción asequible para quienes buscan una memoria microSD con buen rendimiento."
42793,"Ideal para quienes requieren almacenamiento rápido en sus dispositivos móviles."
42794,"Buena opción de memoria SD para cámaras y otros dispositivos que requieren almacenamiento seguro."
42795,"Recomendado para quienes necesitan memoria microSD con alta capacidad y velocidad."
42796,"Memoria microSD fiable, ideal para dispositivos que requieren gran velocidad y fiabilidad."
42797,"Opción de memoria RAM de alto rendimiento para tareas avanzadas."
42798,"Memoria DDR3 de buen rendimiento y costo, ideal para PC de oficina."
42799,"Ideal para quienes buscan mejorar el rendimiento de su laptop con memoria RAM de calidad."
42800,"Producto de excelente relación calidad-precio, ideal para tareas básicas."
42801,"Memoria DDR4 confiable para quienes necesitan buen rendimiento sin un precio elevado."
